Name,Image_URL,Real name,First Appearance,Creators,Team Affiliations,Aliases,Base of Operations,Powers,Skills and Abilities,Tools and Weapons
Deadshot,https://static.wikia.nocookie.net/superheroes/images/a/ac/Deadshot.jpg/revision/latest/scale-to-width-down/250?cb=20141113132728,,"Batman (Vol. 1) #59 (June/July, 1950)","Bob Kane, David Vern Reed, Lew Schwartz",,,Mobile,Increased Accuracy due to cybernetic eye,"Master tactician, Skilled hand-to-hand combatant, Uncanny marksmanship",
Deathlok,https://static.wikia.nocookie.net/superheroes/images/f/f9/Deathlok.jpg/revision/latest/scale-to-width-down/180?cb=20180830001647,,,,,,,,,
Doc Samson,https://static.wikia.nocookie.net/superheroes/images/4/4d/Doc_Samson.jpg/revision/latest/scale-to-width-down/250?cb=20140926030911,,"Incredible Hulk (Vol. 1) #141 (July, 1971)","Roy Thomas, Herb Trimpe",,"Dr. Leonard ""Leo"" Skivorski Jr. (Birth name), Samson",Mobile,"Superhuman strength, stamina, durability and resistance to injury, Great leaping ability, Immunity to Earthly diseases, Resistance to telepathy","Genius psychiatrist, Highly skilled hand to hand combatant, Skilled theoretical technician and inventor",
Doctor Doom,https://static.wikia.nocookie.net/superheroes/images/f/fc/Doctor_Doom.jpg/revision/latest/scale-to-width-down/180?cb=20210112135949,,,,,,,,,
Doctor Strange,https://static.wikia.nocookie.net/superheroes/images/5/55/Doctor_Strange.jpg/revision/latest/scale-to-width-down/344?cb=20240321184948,,,,,,,,,
Donatello,https://static.wikia.nocookie.net/superheroes/images/1/11/Donatello.jpg/revision/latest/scale-to-width-down/250?cb=20140909173320,,"Teenage Mutant Ninja Turtles (Vol. 1) #1 (May, 1984)","Kevin Eastman, Peter Laird",,,New York City,Half-Human/Half-Turtle,"Highly skilled in ninjutsu, Olympic-level agility, speed, and strength, Master of stealth, Genius-level intellect, Expert in various fields of science and engineering, Mastery of bōjutsu and kobudō, Chi Gong",Bo Staff
Doomsday,https://static.wikia.nocookie.net/superheroes/images/4/40/Doomsday.png/revision/latest/scale-to-width-down/238?cb=20200202212018,,,,,,,,,
Dormammu,https://static.wikia.nocookie.net/superheroes/images/8/85/Dormammu.jpg/revision/latest/scale-to-width-down/300?cb=20140111025424,,Strange Tales #126 (Nov. 1964),"Stan Lee, Steve Ditko",,The Dread Dormammu,The Dark Dimension,Seemingly countless magic powers,,
Elastigirl,https://static.wikia.nocookie.net/superheroes/images/d/d3/Elastigirl.jpg/revision/latest/scale-to-width-down/250?cb=20101108015713,Helen Parr,"""The Incredibles"" (October 24, 2004)",,,,Metroville,Elasticity,"Experienced Fighter, Experienced Mother",
Elektra,https://static.wikia.nocookie.net/superheroes/images/7/74/Elektra.jpg/revision/latest?cb=20140516220341,,,,,,,,,
Elongated Man,https://static.wikia.nocookie.net/superheroes/images/f/fc/Elongated_Man.jpg/revision/latest/scale-to-width-down/180?cb=20231226193037,,,,,,,,,
Etrigan,https://static.wikia.nocookie.net/superheroes/images/c/cf/Etrigan.jpg/revision/latest/scale-to-width-down/180?cb=20140501215235,,,,,,,,,
Falcon,"data:image/gif;base64,R0lGODlhAQABAIABAAAAAP///yH5BAEAAAEALAAAAAABAAEAQAICTAEAOw%3D%3D",,"Captain America #117
(September, 1969)","Stan Lee, Gene Colon","The Avengers, SHIELD, Heroes for Hire, ""Defender for a Day""","Snap Wilson, Blackwing, Blackbird, Captain America",New York City,"Flight, Telepathic Communication with Redwing, See Through the Eyes of Birds",Skilled Gymnast and Martial Artist,Flight Suit
Feral,https://static.wikia.nocookie.net/superheroes/images/9/96/Feral.jpg/revision/latest/scale-to-width-down/250?cb=20230914022222,,"New Mutants #99 (January, 1991)","Rob Liefeld, Fabian Nicieza","X-Force, X-Men, X-Corp, Morlocks",Kitten,Krakoa,"Feline senses, Retractable claws, Night vision, Cat-like speed and agility",Fighting Experience,
Fire,https://static.wikia.nocookie.net/superheroes/images/9/95/Fire.jpg/revision/latest/scale-to-width-down/250?cb=20230802232257,,"Super Friends (Vol. 1) #25 (October, 1979) [out of continuity], Infinity, Inc. (Vol. 1) #32 (November, 1986) [in continuity]","E. Nelson Bridwell, Ramona Fradon",,"B. B. da Costa, Green Fury, Green Flame, Black King's Knight",Mobile,"Green Pyrokinesis, Ability to become a being purely composed of living green fire",Fighting Experience,
Firebird,https://static.wikia.nocookie.net/superheroes/images/8/8a/Firebird.jpg/revision/latest/scale-to-width-down/250?cb=20240321181605,,"Incredible Hulk #265 (August, 1981)","Bill Mantlo, Sal Buscema","Avengers, Rangers, Secret Defenders","La Espirita, Firemaiden","Buena Vista, New Mexico","Pyrokinesis, Flight, Radiation Immunity, Immortality","Psychology, Fighting experience",
Firestar,https://static.wikia.nocookie.net/superheroes/images/9/9c/Firestar.jpg/revision/latest/scale-to-width-down/250?cb=20230822173213,,"Uncanny X-Men (Vol. 193) #1 (May, 1985)","Chris Claremont, John Romita Jr.",,Lady Comet,Krakoa,"Microwave manipulation, heat blasts, flight, electromagnetic disruption, flight",Fighting experience,
Flash,https://static.wikia.nocookie.net/superheroes/images/2/24/Flash.jpg/revision/latest/scale-to-width-down/250?cb=20230414171827,,"Showcase #4 (October, 1956)","Robert Kanigher, John Broome, Carmine Infantino",,,Central City,"Super speed, agility, reflexes, Superhuman durability, Molecular density control, Time travel, Cyclone and whirlwindgeneration, Speed theft, Frictionless aura, Healing factor, Intangibility","Fighting Experience, Police Science Expertise and Skilled Hand-to-hand combatant","Ring (Holds Costume), Cosmic Treadmill (can be used to time travel)"
Frigga,https://static.wikia.nocookie.net/superheroes/images/7/7a/Frigga.jpg/revision/latest/scale-to-width-down/250?cb=20170711134512,,"Journey into Mystery #92 (May, 1963)","Stan Lee, Robert Bernstein, Joe Sinnott","Congress of Worlds, Galactic Council, All-Mother of Asgardia, Gods of Asgard, Vanir; formerly Lost Gods","All-Mother Freyja, Frig, Frijja, Fricka, Freda Barker, Freya, Queen Mother, Freyja All-Slave",Asgard,"Super Strength, Super Speed, Magic, All-Speak","Strong Leader, Master of Magic",
Galactus,https://static.wikia.nocookie.net/superheroes/images/1/18/Galactus.webp/revision/latest/scale-to-width-down/180?cb=20221228020152,,,,,,,,,
Gambit,https://static.wikia.nocookie.net/superheroes/images/a/ac/Gambit.jpg/revision/latest/scale-to-width-down/250?cb=20230904172233,,"Uncanny X-Men Annual #14 (July, 1990)[cameo], Uncanny X-Men #266 (August, 1990) [in full]","Chris Claremont, Jim Lee",,"Le Diable Blanc, Robert Lord, Death, Ragin' Cajun","Salem Centre, New York","Control and manipulation of potential energy and kinetic energy, Transmutation of substances into acid or poison [formerly]","Fighting Expertise, High Charisma, Staff Fighting Expertise, Excellent Card player and can throw cards with ease, master thief","Playing Cards, Bo Staff"
Gamora,https://static.wikia.nocookie.net/superheroes/images/d/da/Gamora.jpg/revision/latest/scale-to-width-down/250?cb=20180929223610,,"Strange Tales #180 (June, 1975) [as Gamora], Infinity Wars Prime #1 (September, 2018) [as Requiem]",Jim Starlin,"Guardians of the Galaxy; formerly Nova Corps, Red Team, minion of Thanos, ally of Adam Warlock and Pip the Troll; formerly Infinity Watch, Graces (leader), United Front, Phalanx's Selects","Bambi Long, Gammy, Green Assassin Lady, Most Dangerous Woman in the Galaxy, Nova, Requiem",Mobile,Enhanced Physiology,"Master Martial Artist, Master Assassin, Weapons Master, Expert Marksman, Master Tactician and Strategist, Master Acrobat",
General Zod,https://static.wikia.nocookie.net/superheroes/images/0/06/General_Zod.png/revision/latest/scale-to-width-down/180?cb=20220510005108,,,,,,,,,
Goblin Queen,https://static.wikia.nocookie.net/superheroes/images/2/2d/Goblin_Queen.jpg/revision/latest/scale-to-width-down/180?cb=20240107172237,,"Uncanny X-Men #168 (January, 1983)","Chris Claremont, Paul Smith","Hellfire Club, Sisterhood of Mutants, Dark X-Men","Anodyne, Goblin Queen, Black Rook, Red Queen",Limbo,"Telepathy, Telekinesis, Teleportation, Psionic Energy Absorption, Magic","Skilled hand-to-hand combatant, trained pilot, sorcery",Soul Scythe
Godzilla,https://static.wikia.nocookie.net/superheroes/images/c/cf/Godzilla.jpg/revision/latest/scale-to-width-down/250?cb=20101108015936,,,,,,,"Immense size, atomic breath",,
Goku,https://static.wikia.nocookie.net/superheroes/images/a/a6/Goku.webp/revision/latest?cb=20210312170427,,,,,,,,,
Gorilla Grodd,https://static.wikia.nocookie.net/superheroes/images/6/69/Gorilla_Grodd.jpg/revision/latest/scale-to-width-down/180?cb=20180501140356,,,,,,,,,
Green Goblin,https://static.wikia.nocookie.net/superheroes/images/1/15/Green_Goblin.jpg/revision/latest/scale-to-width-down/250?cb=20150823152735,,"The Amazing Spider-Man (Vol. 1) #14 (July, 1964)","Stan Lee, Steve Ditko",,"Iron Patriot, Goblin King, Mason Banks",New York City,"Superhuman strength, durability, stamina, speed, agility and reflexes, accelerated healing factor, enhanced intelligence","Genius-level intellect, skilled hand-to-hand combatant","Goblin Glider, Pumpkin Bombs, Goblin Glove, Bat Blade"
Guy Gardner,https://static.wikia.nocookie.net/superheroes/images/b/b5/Guy_Gardner.jpg/revision/latest/scale-to-width-down/250?cb=20230423221357,,"Green Lantern (Vol. 2) #59
(March, 1968)","John Broome, Gil Kane",,,Oa,"Wielding Green Lantern, which can create hard light matter constructs [as Green Lantern] Super Strength, shape-shifting weapons construction, energy blasts and energy absorption, healing factor, and vital organ regeneration [as Warrior]",Experienced Fighter,"Green Lantern Ring, Sapphire Lantern Ring [formerly], Red Lantern Ring [formerly], Yellow Lantern Ring [Formerly]"
Havok,https://static.wikia.nocookie.net/superheroes/images/1/1b/Havok.jpg/revision/latest/scale-to-width-down/250?cb=20230822173605,,"Uncanny X-Men (Vol. 1) #54 (March, 1969)","Arnold Drake, Don Heck",,"Mutant X, Magistrate Summers, Goblin Prince",Mobile,Plasma wave blasts,Fighting and leadership experience,
Hawk,https://static.wikia.nocookie.net/superheroes/images/1/1f/Hawk.jpg/revision/latest?cb=20140823200857,,"Showcase #75 (June, 1968) [as Hawk], Armageddon 2001 #1 (May, 1991), Zero Hour #4 (September, 1994)","Steve Ditko, Steve Skeates, Archie Goodwin [Monarch/Extant], Denny O'Neil [Monarch/Extant], Dan Jurgens [Monarch/Extant]",,"Monarch, Extant",No information,"Superhuman strength, durability, stamina, speed, agility and reflexes, Heat vision and Invulnerability, Time travel [as Extant], Chronokinesis [as Extant], Energy Blasts [as Extant], Flight [as Extant], Omniscience [as Extant]",Fighting Experience,
Hawkeye,https://static.wikia.nocookie.net/superheroes/images/a/ad/Hawkeye.jpg/revision/latest/scale-to-width-down/180?cb=20121004171422,,"Tales of Suspense #57 (September, 1964)","Stan Lee, Don Heck",,,New York City,,"Uncanny Archer, Skilled Martial Artist, Skilled Acrobat, Exceptional Arm Strength, Experienced Pilot, Marksman, Swordsman, Master Tactitian","Bow, Arrows, Various Trick Arrows, Bow Staff"
Hawkman,https://static.wikia.nocookie.net/superheroes/images/f/f5/Hawkman.jpg/revision/latest/scale-to-width-down/250?cb=20230418165223,,"Flash Comics (Vol. 1) #1 (January, 1940)","Gardner Fox, Dennis Neville",,,Midway City,"Flight, Memories of Past Lives, Enhanced strength and eyesight
Temperature regulation
Limited physical regeneration

Reincarnation","Fighting Experience, Experienced Flyer","Nth Metal Wings, Nth Metal Mace, Nth Metal Armor"
Hela,https://static.wikia.nocookie.net/superheroes/images/3/3d/Hela.jpg/revision/latest/scale-to-width-down/250?cb=20180202165709,,"Journey into Mystery #102 (March, 1964)","Stan Lee, Jack Kirby","Hell-Lords, Death Gods","The Death Queen, Mistress of the Darkness, Miss Halja",Hel,"Superhuman strength, stamina, and durability, Black magic, Telepathy, Life expansion, Reincarnation, Teleportation, Deadly touch (Hand of Glory), High level mystical powers","Master of Magic, Fighting Experience, Master Strategist",
Hellboy,https://static.wikia.nocookie.net/superheroes/images/9/9d/Hellboy.jpg/revision/latest/scale-to-width-down/180?cb=20111217170557,,,Mike Mignola,B.P.R.D.,"World Destroyer, Great Beast, Beast of the Apocalypse, Right Hand of Doom, Son of the Fallen One, Brother Red, Red, Man-Beast, Mane","Hell, Mobile (formerly), B.P.R.D. headquarters (formerly)","Superhuman strength and endurance, Healing factor, Longevity, Innate capability to comprehend magical languages, Immunity to fire and lightning, The Right Hand of Doom",Expert Monster Fighter and Paranormal Investigator,
Hellcat,https://static.wikia.nocookie.net/superheroes/images/8/8f/Hellcat.jpg/revision/latest/scale-to-width-down/250?cb=20140630233958,,"Miss America Magazine #2 (November, 1944) [as Patsy Walker], The Avengers (vol. 1) #144 (February, 1976) [as Hellcat]",,"Defenders, Avengers, Lady Liberators, Legion of the Unliving",,New York City,"Telekinesis, Psychic resistance, Retractable claws",Well-trained Martial Artist,Wrist-mounted grappling hook
Hercules,https://static.wikia.nocookie.net/superheroes/images/a/a2/Hercules.jpg/revision/latest/scale-to-width-down/258?cb=20150123081313,,,,,,,,,
Hit-Girl,https://static.wikia.nocookie.net/superheroes/images/a/a2/Hit-Girl.png/revision/latest/scale-to-width-down/250?cb=20140727193552,,"Kick-Ass #3 (July, 2008)","Mark Millar, John Romita, Jr.",,,New York City,,Trained as a world-class assassin and martial artist,
Hobgoblin,https://static.wikia.nocookie.net/superheroes/images/2/2b/Hobgoblin.jpg/revision/latest/scale-to-width-down/380?cb=20171022180525,,,,,,,,,
Hollow,https://static.wikia.nocookie.net/superheroes/images/d/dc/Hollow.jpg/revision/latest/scale-to-width-down/250?cb=20230828035655,,"Generation X #1 (November, 1994) [Monet as Penance], Generation X (Vol. 1) #40 (July, 1998) [Twins as Penance], Generation X (Vol. 1) #57 (November, 1999) [as Third Penance]","Scott Lobdell, Chris Bachalo","Loners, Avengers Academy, Generation X",Penance,Currently unknown,"Ultra-Dense Molecular Structure, Invulnerability, Telepathic Resistance, Enhanced Durability, Razor Claws, Light Absorption",Fighting Experience,
Hope Summers,https://static.wikia.nocookie.net/superheroes/images/2/27/Hope_Summers.jpg/revision/latest/scale-to-width-down/200?cb=20240329153119,,"X-Men (Vol. 2) #205 (November, 2007)","Mike Carey, Ed Brubaker, Peter David, Chris Yost, Craig Kyle","X-Men, X-Force","White Phoenix, Mutant Messiah",Krakoa,"Mutant power mimicry, Mutant power activation, Telepathy, Telekinesis, Pryokinesis","Fighting experience, Skilled sharpshooter",Guns
Husk,https://static.wikia.nocookie.net/superheroes/images/0/00/Husk.jpg/revision/latest/scale-to-width-down/250?cb=20230913232744,,"Rom Annual #3 (September, 1984)","Bill Mantlo, William Johnson","Generation X, X-Men, Jean Grey School",Hayseed,Krakoa,Sheds her skin to reveal a body composed of various substances like steel or diamonds,Fighting Experience,
Hydro-Man,https://static.wikia.nocookie.net/superheroes/images/f/f7/Hydro-Man.jpg/revision/latest/scale-to-width-down/231?cb=20141017165100,,,,,,,,,
Iceman,https://static.wikia.nocookie.net/superheroes/images/b/b3/Iceman.jpg/revision/latest/scale-to-width-down/250?cb=20230904164546,,"X-Men (Vol. 1) #1 (September, 1963)","Stan Lee, Jack Kirby",,"Frosty, Iceheart","Westchester, New York","Cryokinesis, organic ice form",Fighting experience,
Impulse,https://static.wikia.nocookie.net/superheroes/images/7/71/Impulse.jpg/revision/latest/scale-to-width-down/250?cb=20230415190854,,"The Flash #91 (June 1994) [cameo], The Flash #92 (July 1994) [full appearance], Teen Titans (Vol. 3) #4 (December, 2003) [as Kid Flash], The Flash: The Fastest Man Alive #1 (May, 2006) [as the Flash]","Mark Waid, Mike Wieringo","Young Justice, Teen Titans, Legion of Super-Heroes, White Lantern Corps","Impulse, Kid Flash, Flash",Central City,Super Speed and related Speed Force powers,"Fighting Experience, Problem Solving Skills",
Indigo,https://static.wikia.nocookie.net/superheroes/images/b/bb/Indigo.jpg/revision/latest/scale-to-width-down/350?cb=20181215144935,,,,,,,,,
Invisible Woman,https://static.wikia.nocookie.net/superheroes/images/a/af/Invisible_Woman.jpg/revision/latest/scale-to-width-down/200?cb=20230710044040,,"The Fantastic Four (Vol. 1) #1 (November, 1961)","Stan Lee, Jack Kirby",,"Invisible Girl, Captain Universe, Susan Benjamin, Malice, Mistress of Hate, Baroness Von Doom, Tabitha Deneuve",New York City,"Invisibility, Invisible force field projection","Fighting Experience, Hand-to-hand combat training",
Iron Fist,https://static.wikia.nocookie.net/superheroes/images/c/c3/Iron_Fist.png/revision/latest/scale-to-width-down/180?cb=20160619135244,"Daniel ""Danny"" Thomas Rand","Marvel Premiere #15 (May, 1974)","Roy Thomas, Gil Kane",,"Daredevil, The Living Weapon, Young Dragon, Daniel Rand-Kai",New York City,"The Iron Fist, a concentration of his chi in his fist, Greatly enhanced physical attributes, Healing powers, Telepathic mind fusion",Master Martial Artist,
Jessica Jones,https://static.wikia.nocookie.net/superheroes/images/3/3b/Jessica_Jones.jpg/revision/latest/scale-to-width-down/256?cb=20170613175306,,,,,,,,,
John Constantine,https://static.wikia.nocookie.net/superheroes/images/3/31/John_Constantine.jpg/revision/latest/scale-to-width-down/250?cb=20200103142235,,"Swamp Thing (vol 2) #25 (June, 1984)","Alan Moore, Steve Bissette, Rick Veitch,
John Totleben","Justice League Dark, The Trenchcoat Brigade, Mucus Membrane, Legends [in television series ""Legends of Tomorrow""]",Hellblazer,"Paddington, London, England (often mobile)","Demon-tainted blood, various magical abilities","Master of Occult and Arcane Knowledge, Skilled Magician, Expert Tactician and Trickster",
Joker,https://static.wikia.nocookie.net/superheroes/images/3/39/Joker.jpeg/revision/latest/scale-to-width-down/250?cb=20141208034831,,"Batman (Vol. 1) #1 (April 25, 1940)","Jerry Robinson, Bill Finger, Bob Kane",,"The Red Hood, The Clown Prince of Crime",Gotham City,,"Genius-level intelligence, Expert chemist and engineer, Skilled in hand-to-hand combat","Knives, Guns, Razor Sharp Playing Cards, Explosive Toys, Presents, Bazooka, Various Custom Explosives, Acid Flower, Joy Buzzer, Joker Gas, Joker Venom"
Jolt,https://static.wikia.nocookie.net/superheroes/images/b/b7/Jolt.jpg/revision/latest/scale-to-width-down/250?cb=20240325050503,,"Thunderbolts #1 (February, 1997)","Kurt Busiek, Mark Bagley","Thunderbolts, Young Allies",Holly Tsuruta,Mobile,"Superhuman agility, Superhuman speed, Hyperkinetic punches, Electrical blasts, Electrical energy form",Fighting Experience,
Jubilee,https://static.wikia.nocookie.net/superheroes/images/6/6f/Jubilee.jpg/revision/latest/scale-to-width-down/250?cb=20230913235629,,"Uncanny X-Men vol. 1 #244 (May, 1989)","Chris Claremont, Marc Silvestri",,,Utopia,"Pyrokinetic Energy Projection of ""plasmoids""(formerly), concussive blasts, immune to telepathic detection",Fighting Experience,
Juggernaut,https://static.wikia.nocookie.net/superheroes/images/7/72/Juggernaut.gif/revision/latest?cb=20170518180851,,"The X-Men (Vol. 1) #12 (July, 1965)","Stan Lee, Jack Kirby","Brotherhood of Mutants, New Excalibur, Lethal Legion","Captain Universe, Kuurth: Breaker of Stone",Mobile,"Superhuman strength, stamina, and durability, Invulnerability via mystical force field, Virtually unstoppable momentum",Fighting Experience,
Karate Kid,https://static.wikia.nocookie.net/superheroes/images/d/d5/Karate_Kid.jpg/revision/latest/scale-to-width-down/250?cb=20230906181701,,Adventure Comics #346 (July 1966),Jim Shooter,Legion of Super-Heroes,,Legion Clubhouse,"Able to sense the weakest spot in an object, and resistance to mind control","Master of every martial art up to the 31st century across the galaxy, Peak of human physical condition",
Killer Croc,https://static.wikia.nocookie.net/superheroes/images/d/d3/Killer_Croc.jpg/revision/latest/scale-to-width-down/250?cb=20140808192434,,"Batman (Vol. 1) #358 (April, 1983)","Gerry Conway, Gene Colan, Don Newton, Curt Swan",,"Croc, King Croc",Gotham City,"Superhuman strength, speed, agility, reflexes, stamina, durability, and senses, hard scale-like skin, razor sharp claws and teeth, Regenerative Healing Factor, Immunity to Toxins","Expert swimmer, Expert Marksman, Experienced alligator wrestler",
Kilowog,https://static.wikia.nocookie.net/superheroes/images/a/ae/Kilowog.jpg/revision/latest/scale-to-width-down/310?cb=20140710161740,,,,,,,,,
Kraven the Hunter,https://static.wikia.nocookie.net/superheroes/images/6/61/Kraven_the_Hunter.jpg/revision/latest/scale-to-width-down/292?cb=20191015131619,,,,,,,,,
Leech,https://static.wikia.nocookie.net/superheroes/images/e/ee/Leech.jpg/revision/latest?cb=20180704113504,,"Masters of the Universe mini-comic,  ""Leech: The Master of Power Suction Unleashed!""",Information needed,The Evil Horde,,"The Fright Zone, Etheria","Super Strength, Energy Draining powers",Fighting Experience,
Leonardo,https://static.wikia.nocookie.net/superheroes/images/0/0b/Leonardo.jpg/revision/latest/scale-to-width-down/300?cb=20140929025349,,,,,,,,,
Lex Luthor,https://static.wikia.nocookie.net/superheroes/images/a/a7/Lex_Luthor.png/revision/latest?cb=20181023142255,,"Action Comics #23 (April, 1940)","Jerry Siegel, Joe Shuster","Injustice League, Injustice Gang, Legion of Doom, Justice League, Secret Six, Intergang, Secret Society, LexCorp","Mockingbird, Apex Lex, Superman, God of Apokolips, Albie",Metropolis,,"Genius Level Egineer, Scientist and Strategist",
Lightning Lad,https://static.wikia.nocookie.net/superheroes/images/7/78/Lightning_Lad.jpg/revision/latest/scale-to-width-down/250?cb=20230428024200,,"Adventure Comics #247 (April, 1958)","Otto Binder, Al Plastino",Legion of Super-Heroes,Livewire,Legion Clubhouse,Electrokinesis,Fighting Experience,
Liz Sherman,https://static.wikia.nocookie.net/superheroes/images/5/56/Liz_Sherman.jpg/revision/latest/scale-to-width-down/250?cb=20150911154425,,"Hellboy: Seed of Destruction #1 (May, 1994)",Mike Mignola,B.P.R.D.,,B.P.R.D. headquarters,Pyrokinesis,Professional paranormal investigator,
Lizard,https://static.wikia.nocookie.net/superheroes/images/2/29/Lizard.jpg/revision/latest?cb=20191113134125,,,,,,,,,
Lobo,https://static.wikia.nocookie.net/superheroes/images/7/71/Lobo.png/revision/latest?cb=20170109010701,,"Omega Men (Vol. 1) #3 (June, 1983)","Roger Slifer, Keith Giffen","L.E.G.I.O.N., Young Justice, Church of the Triple-Fish God, R.E.B.E.L.S., Suicide Squad, Justice League of America","The Main Man, The 'Bo, Master Frag, The Last Czarnian, Mister Machete, Scourge o' the Cosmos, The Ultimate Bastich, Machete Man, El Cazadores",Mobile,"Superhuman senses, strength, speed, stamina and varying durability, Healing factor, Immortality, cloning","Extremely talented killer, genius intellect",
Lyja,https://static.wikia.nocookie.net/superheroes/images/4/4c/Lyja.jpg/revision/latest/scale-to-width-down/200?cb=20230719033221,,"Fantastic Four #265 (May, 1984)","John Byrne, Tom DeFalco, Paul Ryan","Fantastic Four, Future Foundation","Lazerfist, Alicia Masters","Mobile, formerly the Baxter Building","Shapeshifting, energy blasts","trained in hand-to-hand combat, expert spy",
MODOK,https://static.wikia.nocookie.net/superheroes/images/f/fe/MODOK.jpg/revision/latest/scale-to-width-down/250?cb=20180603141419,,"Tales of Suspense #93 (September, 1967) [cameo], Tales of Suspense #94 (October, 1967) ([ull appearance]","Stan Lee, Jack Kirby","AIM, The Headmen, The Intelligencia","MODOC (Mobile Organism Designed Only for Computing), MODOK Superior",Mobile,"Psionic powers, Exceptional ability to calculate probabilities, Superhuman intellect",Super Intelligent,
Magneto,https://static.wikia.nocookie.net/superheroes/images/d/d9/Magneto.jpg/revision/latest/scale-to-width-down/250?cb=20230904162248,,"X-Men (Vol. 1) #1 (July, 1963)","Stan Lee, Jack Kirby","X-Men, Acolytes, Brotherhood of Evil Mutants. Hellfire Club","Erik Lensher, White King",Krakoa,"Magnetic energy manipulation, flight",Fighting experience,
Man-Thing,https://static.wikia.nocookie.net/superheroes/images/9/9d/Man-Thing.jpg/revision/latest/scale-to-width-down/250?cb=20130322041017,,"Savage Tales #1 (May, 1971)","Stan Lee, Roy Thomas, Gerry Conway, Gray Morrow","Thunderbolts, Daydreamers, Legion of Monsters","The Guardian of the Nexus of All Realities, Vorgornus Koth",The Nexus of All Realities (in the Everglades),"Empathic Senses (and is, in a way, an Empathic Mirror), Can Secrete Corrosive Agent, Can Secrete Anti-Corrosive Agent, Super-Strength, Super-Durability, Can Travel Through the Nexus of All Realities, Made Entirely of Plant Matter, Can Regrow Himself From a Piece of Himself",Can Speak 'the Universal Language',
Mandarin,https://static.wikia.nocookie.net/superheroes/images/6/68/Mandarin.jpg/revision/latest/scale-to-width-down/250?cb=20171005174419,,"Tales of Suspense #50 (February, 1964)","Stan Lee, Don Heck","Mandarin's Minions, Hand, Tong","Gene Khan, Zhang Tong, Tem Borjigin",Mandarin City,"Various powers provided by special rings, Access of Chi",Martial Arts and Chi Mastery,
Mantis,https://static.wikia.nocookie.net/superheroes/images/7/74/Mantis.jpg/revision/latest/scale-to-width-down/250?cb=20240401000122,,"Avengers #112 (March, 1973)",,"Avengers, Guardians of the Galaxy",Celestial Madonna,Mobile,"Telepathy, Empathy, Chlorokinesis, Enhanced strength, speed, agility, reflexes, Healing Factor",,
