Name,Image_URL,Real name,First Appearance,Creators,Team Affiliations,Aliases,Base of Operations,Powers,Skills and Abilities,Tools and Weapons
Martian Manhunter,https://static.wikia.nocookie.net/superheroes/images/9/9d/Martian_Manhunter.jpg/revision/latest/scale-to-width-down/250?cb=20240220180242,,"Detective Comics (vol. 1) #225 (November, 1955)","Joseph Samachson, Joe Certa",,"John Jones, The Manhunter from Mars, Bloodwynd, The Last Son of Mars","Several, Often from Wherever the Justice League Headquarters are","Super-Strength, Super-Speed, Agility, Reflexes, Heightened Senses, Shapeshifting, Invulnerability, Invisibility, Telekinesis, Longevity, Intangibility, Super Hearing, Flight, Telepathy, Intelligence, Elongation, Healing Factor, Stamina, Heat generation through Martian vision.","Expert hand-to-hand combatant, Skilled detective",
Medusa,https://static.wikia.nocookie.net/superheroes/images/e/eb/Medusa.jpg/revision/latest/scale-to-width-down/250?cb=20240320155839,,"Fantastic Four (vol. 1) #36 (March, 1965)","Stan Lee, Jack Kirby",,,Attilan,"Strong Prehensile Hair, Superhuman strength, speed, stamina, durability, agility, and reflexes (common among the Inhumans)","Leadership Experience, Great Understanding of Black Bolt's Non-Verbal Communication",
Mera,https://static.wikia.nocookie.net/superheroes/images/c/c4/Mera.jpg/revision/latest?cb=20240220180353,,"Aquaman (Vol. 1) #11 (September, 1963)","Jack Miller, Nick Cardy",,,Atlantis,"Aquakinesis, Can increase density of water and then create any structure with it, Limited telepathy, Enhanced strength, Limited interdimensional travel to Dimension Aqua, Flight, Acidic blood",Fighting Experience,
Metamorpho,https://static.wikia.nocookie.net/superheroes/images/1/14/Metamorpho.jpg/revision/latest?cb=20240223164556,,"The Brave and the Bold #57 (January, 1965)","Bob Haney, Ramona Fradon","Outsiders, Justice League of America, Doom Patrol","Element Man, Dyna-Man",Mobile,"Elemental transformation, shapeshifting",Fighting experience,
Metron,https://static.wikia.nocookie.net/superheroes/images/1/13/Metron.jpg/revision/latest/scale-to-width-down/250?cb=20161230220259,,"New Gods vol. 1 #1 (February–March, 1971)",Jack Kirby,,,Mobile,"Immortality, Super intellect, Universal knowledge, Undefined god-like abilities",Super Intelligence,
Misfit,https://static.wikia.nocookie.net/superheroes/images/1/1e/Misfit.jpg/revision/latest?cb=20230417170202,,,Gail Simone,,"Batgirl, Huntress",Gotham City,"Superhuman strength, Teleportation, Healing factor",Fighting Experience,
Mister Freeze,https://static.wikia.nocookie.net/superheroes/images/4/42/Mister_Freeze.jpg/revision/latest/scale-to-width-down/250?cb=20170630114649,,"Batman (Vol. 1) #121 (February, 1959)","Dave Wood, Sheldon Moldoff","Injustice League, Secret Society of Super Villains, GothCorp",Mr. Zero,Gotham City,Sub-zero physiology,"Superhuman Intelligence, Fighting Experience",
Mister Mxyzptlk,https://static.wikia.nocookie.net/superheroes/images/9/95/Mister_Mxyzptlk.jpg/revision/latest/scale-to-width-down/250?cb=20170428003039,,Superman #30 (Sept. 1944),"Jerry Siegel, Joe Shuster",,"Master Mxyzptlk, Ben DeRoy, Clark Kent, countless others",The 5th Dimension,"Reality manipulation, Not bound by third dimensional laws, Can alter 3-D laws in a manner that resembles magic, Ability to break the 4th wall along with retconning abilities",Extremely Clever,
Mockingbird,https://static.wikia.nocookie.net/superheroes/images/5/59/Mockingbird.jpg/revision/latest/scale-to-width-down/300?cb=20240220041855,,"Astonishing Tales #6 (June, 1971) [cameo as Dr. Barbara Morse], Astonishing Tales #12 (June, 1972) [first full appearance], Marvel Super Action #1 (January, 1976) [as Huntress], Marvel Team-Up (Vol. 1) #95 (July, 1980) [as Mockingbird]","Len Wein, Neal Adams","S.H.I.E.L.D., Avengers, West Coast Avengers, Great Lakes Avengers, Night Shift, Legion of the Unliving, New Avengers, World Counter-terrorism Agency, Secret Avengers, Parker Industries, G.I.R.L, A.I.M (Advanced Idea Mechanics), Underground","Barbara Morse-Barton, Roberta Morse, Agent 19, the Huntress",New York City,"Enhanced strength and agility, Healing and halted aging","Proficient in armed hand to hand combatant, espionage, gymnastics, and martial arts, Expert marksman and mastery of various other weapons, especially her trademark two battle staves",
Moon Knight,https://static.wikia.nocookie.net/superheroes/images/4/4c/Moon_Knight.jpg/revision/latest/scale-to-width-down/250?cb=20170905174808,,"Werewolf by Night #32 (August, 1975)","Doug Moench, Don Perlin","Secret Avengers, Avengers, West Coast Avengers, Defenders, Marvel Knights, Heroes for Hire, United States Marine Corps","Steven Grant, Jake Lockley, The Fist of Khonshu, Yitzak Topol, Mr. Knight",New York City,"Increased strength, endurance, and agility depending on the lunar cycle","Expert detective, Proficient in martial arts and armed combat",
Moonstone,https://static.wikia.nocookie.net/superheroes/images/b/bc/Moonstone.jpg/revision/latest/scale-to-width-down/250?cb=20240325031052,,"Captain America (Vol. 1) #192 (December, 1975) [Karla Sofen], Incredible Hulk (vol. 1) #228 (October, 1978) [as Moonstone], Incredible Hulk (vol. 1) #449 (January, 1997) [as Meteorite], Dark Avengers #1 (March, 2009) [as Ms. Marvel]","Marv Wolfman, Frank Robbins","Dark Avengers, Thunderbolts, Masters of Evil, The Corporation","Meteorite, Ms. Marvel, Captain Marvel",Currently unknown,"Superhuman strength, speed, stamina and reflexes, Gravity manipulation, Flight, Photon blasts, Intangibility, Light generation, Minor molecular control","Expert Psychologist, Expert Hypnotist, Experienced fighter",
Multiple Man,https://static.wikia.nocookie.net/superheroes/images/0/08/Multiple_Man.jpg/revision/latest/scale-to-width-down/250?cb=20140121050306,,"Giant Size Fantastic Four #4, (February 1975)","Len Wein, Chris Claremont, John Buscema",,"Madrox the Multiple Man, Multiple, Reverend John Maddox","New York, USA","Self-Duplication, Can Absorb Living Duplicates","Due to his ability, he has absorbed many skills that his duplicates have acquired after absorbing them",
Mysterio,https://static.wikia.nocookie.net/superheroes/images/2/2a/Mysterio.jpg/revision/latest/scale-to-width-down/250?cb=20180325124110,,"The Amazing Spider-Man (Vol. 1) #13 (June, 1964)","Stan Lee, Steve Ditko","Maggia, Sinister Six",Dr. Ludwig Rinehart,New York City,,"Expert in illusion, special effects, robotics, chemistry, hypnosis",
Namora,https://static.wikia.nocookie.net/superheroes/images/f/fb/Namora.jpg/revision/latest/scale-to-width-down/250?cb=20140620192934,,Marvel Mystery Comics #47 (May 1947),,,,Atlantis,"Hydrokinesis, Super strength, limited invulnerability, swim at superhuman speeds, ability to breathe both water and air, slowed aging process, and wings-like appendages on her ankles that allow her to fly.",Fighting Experience,
Namorita,https://static.wikia.nocookie.net/superheroes/images/5/5b/Namorita.jpg/revision/latest/scale-to-width-down/250?cb=20240401032536,,"Sub-Mariner #50 (June, 1972)",Bill Everett,,,Atlantis,"Aquatic adaptation, Super strength, high speed swimming, atmospheric flight
Touch can create burning acid or paralytic toxin, Can become transparent",Fighting Experience,
Nathan Petrelli,https://static.wikia.nocookie.net/superheroes/images/f/fa/Nathan_Petrelli.jpg/revision/latest/scale-to-width-down/180?cb=20170714212921,,,,,,,,,
Nightcrawler,https://static.wikia.nocookie.net/superheroes/images/9/93/Nightcrawler.jpg/revision/latest?cb=20230904172538,,"Giant-Size X-Men #1 (May, 1975)","Len Wein, Dave Cockrum",,"Fuzzy Blue Elf, Kurt Szardos","Salem Center, New York","Teleportation, Super-Agility, Ability to Stick to Walls, Prehensile Tale, Ability to Blend into Shadows, Night Vision",,Occasionally fights with a fencing foil
Nightwing,https://static.wikia.nocookie.net/superheroes/images/8/89/Nightwing.jpg/revision/latest/scale-to-width-down/250?cb=20230413171534,,"Detective Comics (Vol. 1) #38 (April 1940) [as Robin], Tales of the Teen Titans #44 (July, 1984) [as Nightwing], Batman: Battle for the Cowl #3 (July, 2009) [as Batman]","Bob Kane, Bill Finger, Jerry Robinson","Batman Family, Teen Titans, Young Justice, Outsiders, Justice League, Batman Inc., Spyral, Super Friends (animation only)","Robin, Nightwing, Batman, The Target, Renegade, Agent 37[2] Robbie Malone, Freddy Loyd, Chester Honeywell, Freddie Dinardo","Gotham City, previously New York City and Blüdhaven",,"Peak human level athlete, Master martial artist, acrobat, detective, tactician, and field commander","Escrima Sticks, various spy and detective tools"
Northstar,https://static.wikia.nocookie.net/superheroes/images/7/7f/Northstar.jpg/revision/latest?cb=20230904171847,,"Uncanny X-Men #120 (April, 1979)","Chris Claremont, John Byrne",,Jean-Paul Martin,currently unknown,"Superhuman speed and durability, Flight, Light manipulation",Fighting Experience,
Nova,https://static.wikia.nocookie.net/superheroes/images/c/c3/Nova.jpg/revision/latest/scale-to-width-down/250?cb=20240401194657,,"Marvel Point One #1 (November, 2011)","Jeph Loeb, Ed McGuinness","Nova Corps, New Warriors, New Avengers, Avengers, S.H.I.E.L.D., Champions","Alexander-the-not-so-great, Black Nova, Bilbo, Bucket Head, Darth Nova, Human Rocket, Kid Nova, Nova-Sam, Samuel Alejandro, Xandarian Pawn","Carefree, Arizona","Superhuman strength and durability, Flight, Energy projection, Universal translation, Ability to survive in space",Experienced fighter,
Ozymandias,https://static.wikia.nocookie.net/superheroes/images/5/5b/Ozymandias.jpg/revision/latest/scale-to-width-down/250?cb=20170210020030,,"Watchmen #1 (September, 1986)","Alan Moore,Dave Gibbons",Crimebusters (briefly),The Smartest Man in the World,New York City,,"Super Intelligence, Peak Level Athlete (Strength, Speed, Reflexes), Skilled in a Large Number of Sciences and Disciplines, Master Strategist",
Phantom,https://static.wikia.nocookie.net/superheroes/images/f/f8/Phantom.jpg/revision/latest/scale-to-width-down/180?cb=20170421002505,,,,,,,,,
Plastic Man,https://static.wikia.nocookie.net/superheroes/images/d/d6/Plastic_Man.jpg/revision/latest/scale-to-width-down/250?cb=20180130013032,,"Police Comics #1 (August, 1941)",,"Justice League, FBI, Freedom Fighters, NBI, All-Star Squadron, Elastic Four, Secret Six, Terrifics, Justice League of Anarchy","Plastic Man, ""Eel"" O'Brian","Mammoth City, USA","Elasticity, Plasticity, Malleability, Resilience, Durability, Agility, Regeneration, Immunity to Telepathy, Invulnerability, Immortality","Sneaky, Creative",
Polaris,https://static.wikia.nocookie.net/superheroes/images/5/59/Polaris.jpg/revision/latest/scale-to-width-down/150?cb=20230801032312,,"X-Men (Vol. 1) #49 (August, 1968)","Arnold Drake, Don Heck",,"Magnetrix, Malice, Pestilence",Krakoa,"Magnetic field manipulation, flight",,
Power Girl,https://static.wikia.nocookie.net/superheroes/images/f/f2/Power_Girl.jpg/revision/latest/scale-to-width-down/180?cb=20230411032120,,"All-Star Comics #58 (February, 1976)","Gerry Conway, Ric Estrada",,"Nightwing, Karen Starr, Paige Stetler, Supergirl",Mobile,"Superhuman strength, speed & stamina, various extra sensory and vision powers, invulnerability, and flight",Skilled Martial Artist,
Professor X,https://static.wikia.nocookie.net/superheroes/images/4/4a/Professor_X.jpg/revision/latest/scale-to-width-down/200?cb=20240311171247,,"X-Men (Vol. 1) #1 (September, 1963)","Stan Lee, Jack Kirby","X-Men, Illuminati, Genoshan Excalibur, Cadre K, Brotherhood of Mutants, Shi'ar Imperium, Starjammers, The Twelve, Defenders","Onslaught, Consort-Royal, Founder, X, Warlord, Entity","Salem Center, New York","Telepathy, Psychic Empathy, Mind-reading and control, Memory alteration and erasure, Mental bolts, Psionic blasts, Induced paralysis, Illusion casting, Astral projection, Eidetic memory","Genius-Level Intellect, Skilled Strategist and Teacher,","Cerebro, Wheelchair (in some cases, a high tech chair), The Danger Room"
Psylocke,https://static.wikia.nocookie.net/superheroes/images/8/85/Psylocke.jpg/revision/latest/scale-to-width-down/180?cb=20230914215157,,"Captain Britain (vol. 1) #8 (December, 1976)","Chris Claremont, Herb Trimpe","X-Men, Captain Britain Corps, Excalibur, Exiles, The Hand, X-Force","Psylocke, Lady Briton, Lady Mandarin",Krakoa,"Telekinesis, Telepathy, Precognition, Ability to construct weapons made of psychic energy, usually in the form of a blade",Expert martial artist,
Pyro,https://static.wikia.nocookie.net/superheroes/images/4/49/Pyro.jpg/revision/latest/scale-to-width-down/250?cb=20190123174742,,"X-Men (Vol. 1) #141 (January, 1981)","Chris Claremont, John Byrne","Brotherhood of Evil Mutants, Freedom Force",,Mobile,"Fire Control, Fire Invulnerability",Fighting Experience,
Quantum,https://static.wikia.nocookie.net/superheroes/images/0/05/Quantum.jpg/revision/latest/scale-to-width-down/262?cb=20150523132046,,,,,,,,,
Quicksilver,https://static.wikia.nocookie.net/superheroes/images/b/ba/Quicksilver.jpg/revision/latest/scale-to-width-down/250?cb=20240225051024,,"The X-Men (Vol. 1) #4 (March, 1964)","Stan Lee, Jack Kirby","Avengers, Inhumans, X-Factor, Brotherhood of Evil Mutants","Pietro Frank, Mateo Maximoff, Peter Maximoff",New York City,Super Speed,Fighting Experience,
Ra's Al Ghul,https://static.wikia.nocookie.net/superheroes/images/5/56/Ra%27s_Al_Ghul.png/revision/latest?cb=20160608140330,,"Batman (Vol. 1) #232 (June, 1971)","Julius Schwartz, Dennis O'Neil, Neal Adams","The Demon, League of Assassins, Underground Society","Ra's, The Demon's Head",Mobile,Longevity,"Criminal mastermind, Skilled martial artist and hand-to-hand combatant, Skilled alchemist, demonologist, and swordsman",
Raphael,https://static.wikia.nocookie.net/superheroes/images/6/6c/Raphael.jpg/revision/latest/scale-to-width-down/250?cb=20140707232819,,"Teenage Mutant Ninja Turtles #1 (May, 1984)","Kevin Eastman, Peter Laird",,"The Shredder, Nightwatcher",New York City,Half-Human/Half-Turtle Creature,"Highly skilled in ninjutsu, Olympic-level agility, speed, and strength, Mastery of kobudo, Master of stealth, Chi Gong, Master of twin offensive/defensive sai",Twin offensive/defensive sai
Ray,https://static.wikia.nocookie.net/superheroes/images/d/d0/Ray.jpg/revision/latest/scale-to-width-down/250?cb=20240221184352,,"The Ray #1 (February, 1992)","Jack C. Harris, Joe Quesada","Freedom Fighters, Justice League of America, Justice League Task Force, Young Justice, JSA Reserves, Forgotten Heroes, Justice League International",,"Philadelphia, Pennsylvania","Flight, Light Manipulation, Light Absorption, Light Projection","Programming, Fighting Experience",
Red Hood,https://static.wikia.nocookie.net/superheroes/images/5/59/Red_Hood.jpg/revision/latest/scale-to-width-down/180?cb=20140708202020,,,,,,,,,
Red Hulk,https://static.wikia.nocookie.net/superheroes/images/c/c8/Red_Hulk.png/revision/latest/scale-to-width-down/372?cb=20181226204728,,,,,,,,,
Red Mist,https://static.wikia.nocookie.net/superheroes/images/a/a1/Red_Mist.jpg/revision/latest/scale-to-width-down/250?cb=20190726165558,,"Kick-Ass (Vol. 1) #4 (October, 2008)","Mark Millar, John Romita Jr.","Genovese Crime Family, The Toxic Mega Cunts",The Motherfucker,New York City,,Competant Novice Fighter,
Red Robin,https://static.wikia.nocookie.net/superheroes/images/a/a0/Red_Robin.jpg/revision/latest/scale-to-width-down/180?cb=20240105192223,,"Batman #436 (August, 1989)","Marv Wolfman, Pat Broderick",,"Robin, Batman, Tim Wayne",Gotham City,,"Detective, Computer Hacker, Master martial artist,","Batarangs, Various Bat-Tools"
Rogue,https://static.wikia.nocookie.net/superheroes/images/f/f6/Rogue.jpg/revision/latest/scale-to-width-down/250?cb=20230904160419,,"Avengers Annual #10 (October, 1981)","Chris Claremont, Michael Golden","X-Men, Excalibur, Avengers, Brotherhood of Evil Mutants",Anna Raven,Krakoa,"Bio-energy absorbing touch, Superhuman strength, Invulnerability, Flight",Fighting experience,
Rorschach,https://static.wikia.nocookie.net/superheroes/images/6/64/Rorschach.jpg/revision/latest/scale-to-width-down/250?cb=20120406201510,,"Watchmen #1 (September, 1986)","Alan Moore, Dave Gibbons",,,New York City,,"Hand-to-hand combat expertise, Detective Expertise",Uses Improvised Weapons
Sabretooth,https://static.wikia.nocookie.net/superheroes/images/e/e2/Sabretooth.jpg/revision/latest?cb=20140118050419,,"Iron Fist #14, (August 1977)","Chris Claremont, John Byrne",,"Slasher, El Tigre, Der Schlächter",Nomadic,"Accelerated Healing Factor, Resistance to Mental Control, Unusually Sharp Teeth, Retractable Claws, Longevity in Age, Superhuman Senses, Strength, Stamina, Agility, and Reflexes","Fighting Expertise, Killing Expertise",Will occasionally use guns and knives
Sage,https://static.wikia.nocookie.net/superheroes/images/7/70/Sage.jpg/revision/latest?cb=20240110172834,,,,,,,,,
Sandman,https://static.wikia.nocookie.net/superheroes/images/1/13/Sandman.jpeg/revision/latest/scale-to-width-down/180?cb=20160805114334,,,,,,,,,
Sauron,https://static.wikia.nocookie.net/superheroes/images/3/3a/Sauron.jpg/revision/latest/scale-to-width-down/250?cb=20140617185639,,"X-Men (Vol. 1) #59 (August, 1969) [as Karl Lykos], X-Men (Vol. 1) #60 (September, 1969) [as Sauron]","Roy Thomas, Neal Adams",,,The Savage Land,"Flight, Pterodactyl-Like Body (including wings), Life-Force Absorption, Mutant Power Absorption, Concussive Bursts, Superhuman Strength, Fire Breath, Hypnosis",Fighting Experience,
Savage Dragon,https://static.wikia.nocookie.net/superheroes/images/b/b1/Savage_Dragon.jpg/revision/latest/scale-to-width-down/180?cb=20140605160723,,,,,,,,,
Scarecrow,https://static.wikia.nocookie.net/superheroes/images/9/98/Scarecrow.jpg/revision/latest/scale-to-width-down/180?cb=20180505002721,,,,,,,,,
Sebastian Shaw,https://static.wikia.nocookie.net/superheroes/images/6/63/Sebastian_Shaw.jpg/revision/latest/scale-to-width-down/180?cb=20210905195204,,,,,,,,,
Sentry,https://static.wikia.nocookie.net/superheroes/images/4/4c/Sentry.jpg/revision/latest/scale-to-width-down/250?cb=20240320175403,,"The Sentry #1 (September, 2000)","Paul Jenkins, Jae Lee, Rick Veitch",,,New York City,"Superhuman strength, speed, stamina, agility, reflexes, senses, durability and Invulnerability, Energy projection and manipulation, Matter manipulation, Flight, Telepathy, Resurrection, Healing factor, Mental projection",Fighting Experience,
Shadow Lass,https://static.wikia.nocookie.net/superheroes/images/7/7e/Shadow_Lass.jpg/revision/latest/scale-to-width-down/200?cb=20230501175959,,"Adventure Comics #365 (February, 1968)","Jim Shooter, Kurt Swan","Legion of Super-Heroes,",Umbra,Legion Clubhouse,"Dark energy projection, Shadow manipulation, Night vision",Hand-to-hand combat,
Shadowcat,https://static.wikia.nocookie.net/superheroes/images/3/33/Shadowcat.jpg/revision/latest/scale-to-width-down/180?cb=20230802174025,,,,,,,,,
Shang-Chi,https://static.wikia.nocookie.net/superheroes/images/3/31/Shang-Chi.jpg/revision/latest/scale-to-width-down/180?cb=20140815190153,,,,,,,,,
Shatterstar,https://static.wikia.nocookie.net/superheroes/images/c/c5/Shatterstar.jpg/revision/latest/scale-to-width-down/200?cb=20230914191701,,"New Mutants #99 (January, 1991)","Rob Liefeld, Fabian Nicieza","X-Force, X-Factor",Star,Krakoa,"Enhanced strength, speed, and agility, Bio-energy conduction through metal, Empathically fuels teleportation",Fighting Experience,
She-Hulk,https://static.wikia.nocookie.net/superheroes/images/7/77/She-Hulk.jpg/revision/latest/scale-to-width-down/250?cb=20240320173924,,"Savage She-Hulk #1 (February, 1980) [as She-Hulk], Hulk (vol. 4) #6 (July, 2017) [as Hulk]","Stan Lee, John Buscema","Avengers; formerly Ancient Order of the Shield, A-Force, Mighty Avengers, Fantastic Four, Future Foundation, Incredible Hulks, Fantastic Force, Heroes for Hire, Fearsome Four, S.H.I.E.L.D., Goodman, Lieber, Kurtzberg & Holliway, Defenders, Hulkbusters, Lady Liberators, Freeman Bonding Inc., Brides of Set, Queen's Vengeance, Law Offices of Jennifer Walters, PLLC, Ryu, Barber, Zucker & Scott","Hulk, Glamazonia, Jennifer Jameson, Jennifer Smith, Jade Giantess, Nurse Jennifer Emerald, ""Shulkie"", She-Xemnu, Lady Hulk, Hulkette, Queen Green, Gamora, Jenny-Poo, Green Cheeks, Freakjob, Jenny/Miss Jenny, Savage She-Hulk, Gamma Gal/Glamma Gal, Earth-Sow, Green Jeans, Ghost-Girl",New York City,"Super Strength, Super Endurance, Transformation, Healing Factor","Skilled Fighter, Expert Attorney, Trained Pilot",
Sif,https://static.wikia.nocookie.net/superheroes/images/6/6b/Sif.jpg/revision/latest/scale-to-width-down/250?cb=20190912175009,,"Journey into Mystery #102 (March, 1964)","Stan Lee, Jack Kirby","The Gods of Asgard, War Avengers; formerly Lost Gods, League of Realms","The Stunning Sif, Sif the Unstoppable, Fair Sif, Fair One, Fairest of the Fair, Gentle Sif, Gentlest of the Gentle, the Dark-Haired Daughter of Asgard, Ericka Velez, Rose Chambers, Sybil, Tiffany, Tif",Asgard,"Superhuman strength, endurance, longevity, durability","Master of hand-to-hand combat, Skilled in cold weapons",
Silk,https://static.wikia.nocookie.net/superheroes/images/2/2d/Silk.jpg/revision/latest/scale-to-width-down/250?cb=20230830185929,,"Amazing Spider-Man (Vol. 3) #1 (April, 2014)","Dan Slott, Humberto Ramos","Web-Warriors, Order of the Web, Spider-Army","Spider-Woman, Silkworm","New York City, New York","Superhuman strength, superhuman agility, enhanced speed and reflexes, precognitive spider-sense, wall crawling, retractable fingertip claws, organic web spinning.","Tracking, skilled fighter",
Silver Surfer,https://static.wikia.nocookie.net/superheroes/images/9/92/Silver_Surfer.jpg/revision/latest/scale-to-width-down/250?cb=20240321184311,,"The Fantastic Four (Vol. 1) #48 (March, 1966)",Jack Kirby,,,None (Nomadic),"Endowed with the Power Cosmic, that allows, among other powers, faster than light speed, matter transmutation and flight","Fighting Experience, Great Intelligence and Wisdom",Board
Siryn,https://static.wikia.nocookie.net/superheroes/images/c/cd/Siryn.jpg/revision/latest/scale-to-width-down/250?cb=20230914020225,,"Spider-Woman #37 (December, 1980)","Chris Claremont, Steve Leialoha","x-Force, X-Men, X-Corp, X-Factor",Banshee,Krakoa,"Sonic scream, Hypnotic song, Flight",Fighting Experience,
Skaar,https://static.wikia.nocookie.net/superheroes/images/9/92/Skaar.jpg/revision/latest?cb=20200424001242,,,,,,,,,
Snowbird,https://static.wikia.nocookie.net/superheroes/images/f/f7/Snowbird.jpg/revision/latest?cb=20170703174550,,"Uncanny X-Men #120 (April, 1979)",John Byrne,"Alpha Flight, The Flight, Royal Canadian Mounted Police, God Squad","Anne McKenzie, Anne McKenzie-Thompson, Ice Queen","Ottawa, Ontario",Fighting Experience,,
Sobek,https://static.wikia.nocookie.net/superheroes/images/5/5c/Sobek.jpg/revision/latest?cb=20200109005847,,,,,,,,,
Songbird,https://static.wikia.nocookie.net/superheroes/images/8/86/Songbird.jpg/revision/latest?cb=20240325153649,,"Marvel Two-In-One #54 (May, 1979)","Mark Gruenwald, Ralph Macchio, John Byrne","Avengers, Thunderbolts",Screaming Mimi,New Jersey,"Sonic scream, Flight, Sonic energy constructs",Fighting Experience,
Space Ghost,https://static.wikia.nocookie.net/superheroes/images/4/49/Space_Ghost.jpg/revision/latest/scale-to-width-down/250?cb=20140111031255,,"Space Ghost, ""The Heat Thing"" (September 10, 1966)",,,,"Nomadic (original series), Ghost Planet (Coast to Coast)","Flight, Super strength, stamina, durability,  endurance and agility, Teleportation, Invisibility (from his belt), Energy Beam (from power bands)",Hosting Expertise (Coast to Coast),"Power Bands, Invisibility Belt"
Spawn,https://static.wikia.nocookie.net/superheroes/images/d/d3/Spawn.jpg/revision/latest/scale-to-width-down/250?cb=20130322040132,,"Albert Francis ""Al"" Simmons",,,"Hellspawn, The One",New York City,"Countless Demonic Powers (in main article, coming soon)","Skilled Martial Artist, Trained Soldier and Assassin",
Speedball,https://static.wikia.nocookie.net/superheroes/images/f/fd/Speedball.jpg/revision/latest/scale-to-width-down/250?cb=20240401032615,,"The Amazing Spider-Man Annual #22 (January, 1988) [As Speedball], Civil War: Front Line #10 (January, 2007) [as Penance]","Steve Ditko, Tom DeFalco",,"Penance, Masked Marvel",New York City,Force field generation,Fighting Experience,
Spider-Woman,https://static.wikia.nocookie.net/superheroes/images/6/63/Spider-Woman.jpg/revision/latest/scale-to-width-down/250?cb=20230418171908,,"Marvel Spotlight #32 (February, 1977)","Archie Goodwin, Marie Severin","Avengers, HYDRA, Lady Liberators, New Avengers, S.H.I.E.L.D., S.W.O.R.D., Secret Avengers","Arachne, Ariadne Hyde, Hunter",New York City,"Superhuman strength, speed, durabilty, reflexes, and senses, Flight, Pheromone manipulation, Bio-electric energy projection, Wallcrawling",Master spy,
Star-Lord,https://static.wikia.nocookie.net/superheroes/images/b/ba/Star-Lord.jpg/revision/latest/scale-to-width-down/250?cb=20240331220501,,Marvel Preview #4 (January 1976),"Steve Englehart, Steve Gan","Guardians of the Galaxy, Ravagers, United Front, Shi'ar Imperial Guard, Ship, Avengers",,Knowhere,"Enhanced durability, Enhanced reflexes, Increased longevity, Healing factor, Levitation, Light projection, Psychic awareness","Skilled marksman, skilled combatant",
Starfire,https://static.wikia.nocookie.net/superheroes/images/3/37/Starfire.jpg/revision/latest/scale-to-width-down/250?cb=20240220193345,,"DC Comics Presents #26 (October, 1980)","Marv Wolfman, George Pérez","Teen Titans, Titans, Justice League of America, Outsiders",,Mobile,"Super strength, Flight, Solar energy blast, Language absorption",Expert hand-to-hand combatant,
Static,https://static.wikia.nocookie.net/superheroes/images/a/a7/Static.jpg/revision/latest/scale-to-width-down/250?cb=20101108015840,,,,,,,Electrical control,,
